{
  "job_id": "base16_m2",
  "codec": "base16",
  "stage": "m2",
  "timestamp": "2026-06-21T06:07:51.830292+00:00",
  "status": "pass",
  "checks": {
    "all_byte_exact": true,
    "corpus_min": true
  },
  "metrics": {
    "byte_exact": true,
    "reencode_samples": 10,
    "test_cases": 10
  },
  "tags": [
    "generated",
    "reencode",
    "direction1",
    "byte_exact"
  ],
  "scope": "full",
  "notes": "base16 M2 (Direction 1): machine-written re-encoder reproduces real base16 output on 10/10 corpus files byte-for-byte.",
  "provenance": {
    "produced_at": "2026-06-21T06:07:51.864237+00:00",
    "device": "localhost",
    "code_sha": "c8c06905884828f2a1f042e570e062dafcf45c3b",
    "code_dirty": true,
    "orchestration_version": "2.0-legitimacy",
    "verifier": "make_m2_verifier.<locals>.verify",
    "source_hash": "182ec13a4731b409"
  },
  "saved_at": "2026-06-21T00:07:51.864719"
}