{
  "job_id": "snappy_m2",
  "codec": "snappy",
  "stage": "m2",
  "timestamp": "2026-06-20T03:17:47.824365+00:00",
  "status": "not_implemented",
  "metrics": {},
  "notes": "No verifier registered for snappy/m2. This stage does no work yet \u2014 reporting the truth, not a pass.",
  "provenance": {
    "produced_at": "2026-06-20T03:17:47.859345+00:00",
    "device": "MacBookPro.lan",
    "code_sha": "bfeb454899a0fa1b548836434d23d83f985658b0",
    "code_dirty": false,
    "orchestration_version": "2.0-legitimacy"
  },
  "saved_at": "2026-06-19T21:17:47.936225"
}