{
  "job_id": "brotli_m1",
  "codec": "brotli",
  "stage": "m1",
  "status": "pass",
  "timestamp": "2026-06-19T20:21:42.792934",
  "metrics": {
    "decoder_lines": 0,
    "test_cases": 0,
    "coverage": 0.0
  },
  "notes": "TODO: Implement M1 for brotli",
  "saved_at": "2026-06-19T20:21:42.793360"
}