{
  "job_id": "base16_m4",
  "codec": "base16",
  "stage": "m4",
  "timestamp": "2026-06-21T06:08:08.723081+00:00",
  "status": "not_implemented",
  "metrics": {},
  "notes": "No verifier registered for base16/m4. This stage does no work yet \u2014 reporting the truth, not a pass.",
  "provenance": {
    "produced_at": "2026-06-21T06:08:08.792769+00:00",
    "device": "localhost",
    "code_sha": "5f68a7e9487b71d1658eb8cfd057bc4087058ebb",
    "code_dirty": false,
    "orchestration_version": "2.0-legitimacy"
  },
  "saved_at": "2026-06-21T00:08:08.793524"
}