{
  "job_id": "snappy_m3",
  "codec": "snappy",
  "stage": "m3",
  "status": "pass",
  "timestamp": "2026-06-19T20:24:51.776360",
  "metrics": {
    "decoder_lines": 0,
    "test_cases": 0,
    "coverage": 0.0
  },
  "notes": "TODO: Implement M3 for snappy",
  "saved_at": "2026-06-19T20:24:51.776776"
}