{
  "job_id": "lzma_m0",
  "codec": "lzma",
  "stage": "m0",
  "timestamp": "2026-06-20T06:08:13.579001+00:00",
  "status": "pass",
  "checks": {
    "all_byte_exact": true,
    "corpus_min": true
  },
  "metrics": {
    "files_decoded": 10,
    "test_cases": 10,
    "byte_exact": true,
    "decoder_lines": 336
  },
  "tags": [
    "lzma",
    "range_coder",
    "lz77",
    "adaptive"
  ],
  "scope": "full",
  "notes": "LZMA FORMAT_ALONE: decoder reproduces 10/10 stdlib-compressed streams byte-exact.",
  "provenance": {
    "produced_at": "2026-06-20T06:08:13.711978+00:00",
    "device": "localhost",
    "code_sha": "1730779abb28413d90ad43922fd151e8f111293b",
    "code_dirty": true,
    "orchestration_version": "2.0-legitimacy",
    "verifier": "verify_lzma_m0",
    "source_hash": "8a96633e9a2478fa"
  },
  "saved_at": "2026-06-20T00:08:13.712322"
}