{
  "job_id": "png_m0",
  "codec": "png",
  "stage": "m0",
  "timestamp": "2026-06-20T06:30:28.742225+00:00",
  "status": "pass",
  "checks": {
    "all_byte_exact": true,
    "corpus_min": true
  },
  "metrics": {
    "files_decoded": 10,
    "test_cases": 10,
    "byte_exact": true,
    "decoder_lines": 243
  },
  "tags": [
    "image",
    "png",
    "lossless"
  ],
  "scope": "full",
  "notes": "PNG decoder: from-scratch decode(encode(pixels)) roundtrip - 10/10 byte-exact. Corpus: sized 1x1 to 256x1, color types 0/2/6, bit_depth 8 everywhere.",
  "provenance": {
    "produced_at": "2026-06-20T06:30:28.867918+00:00",
    "device": "localhost",
    "code_sha": "ceec1d52bf5f799c76110dedbd6a1c21d1a09a31",
    "code_dirty": false,
    "orchestration_version": "2.0-legitimacy",
    "verifier": "verify_png_m0",
    "source_hash": "44aa290df8427341"
  },
  "saved_at": "2026-06-20T06:31:00"
}