{
  "job_id": "gzip_m3",
  "codec": "gzip",
  "stage": "m3",
  "timestamp": "2026-06-20T04:11:39.608821+00:00",
  "status": "pass",
  "checks": {
    "counting_cell_on_multiset": true,
    "multiset_coarsens_more": true,
    "gauge_has_no_orbit": true
  },
  "metrics": {
    "mode_a_flavor": "counting",
    "cell_count": 3,
    "orbit_count": 0,
    "best_genuine_width": 135,
    "n_dynamic": 40
  },
  "tags": [
    "counting_cell",
    "cell_only",
    "gauge_invariant_multiset",
    "direction2"
  ],
  "scope": "full",
  "notes": "gzip M3 (Direction 2): Mode-A preimage is a counting CELL on the gauge-invariant multiset (width 135 > 0, biggest cell 3, 40 dynamic blocks); canonical gauge pinned -> NO orbit. Cell-only.",
  "provenance": {
    "produced_at": "2026-06-20T04:11:40.120101+00:00",
    "device": "localhost",
    "code_sha": "852fe322cac6ae5de66a17e406633b1ccd01dace",
    "code_dirty": false,
    "orchestration_version": "2.0-legitimacy",
    "verifier": "verify_gzip_m3",
    "source_hash": "80ec9cb97c9327fb"
  },
  "saved_at": "2026-06-19T22:11:40.120453"
}